{
  "title_top": "生成AI",
  "title_mid": "2025年",
  "title_bottom": "トレンド",
  "subtitle": "主要な技術動向と今後の展望",
  "sections": [
    {
      "number": "01",
      "name": "マルチモーダル",
      "slides": [
        {
          "type": "overview",
          "title_top": "AI",
          "title_bottom": "マルチモーダル",
          "subtitle": "統合理解の時代へ",
          "detail": "テキスト・画像・音声・動画を統合処理するモデルが主流に。",
          "body": "GPT-4o、Gemini、Claude等が対応強化。標準機能として定着。"
        }
      ]
    },
    {
      "number": "02",
      "name": "エージェント",
      "slides": [
        {
          "type": "cards",
          "title": "エージェントの主要カテゴリ",
          "body": "自律型AIが急速に普及。各領域で活用拡大。",
          "cards": [
            ["コーディング", "PR作成からバグ修正まで自動化"],
            ["業務自動化", "定型業務の自律実行が加速"],
            ["リサーチ", "情報収集と統合を自動化"],
            ["協調型AI", "複数AIが協調して解決"]
          ]
        },
        {
          "type": "stats",
          "stats": [
            ["300%", "市場の成長率"],
            ["x2.5", "生産性の向上"],
            ["85%", "大企業の導入率"]
          ]
        }
      ]
    },
    {
      "number": "03",
      "name": "オープンソース",
      "slides": [
        {
          "type": "timeline",
          "title": "OSS AIの進化",
          "timeline": [
            ["2023", "Llama 2公開", "Meta、商用利用を許可"],
            ["2024", "性能の急接近", "GPT-4に迫る性能を達成"],
            ["2025", "実用化加速", "企業導入が加速"]
          ],
          "body": "APIの代替から独自の強みを持つ選択肢へ。"
        }
      ]
    }
  ],
  "closing_quote": "AIは道具を超え、パートナーへ"
}
